<?xml version="1.0" encoding="UTF-8"?>
<module xmlns="http://thelia.net/schema/dic/module"
        xmlns:xsi="http://www.w3.org/2001/XMLSchema-instance"
        xsi:schemaLocation="http://thelia.net/schema/dic/module http://thelia.net/schema/dic/module/module-2_1.xsd">
    <fullnamespace>AttributeType\AttributeType</fullnamespace>
    <descriptive locale="en_US">
        <title>Attribute type</title>
        <description>Allows managing the attribute types, eg color, weight ...</description>
    </descriptive>
    <descriptive locale="fr_FR">
        <title>Type de déclinaison</title>
        <description>Permet de gérer des types de déclinaison, exemple : couleur, poid ...</description>
    </descriptive>
    <!-- <logo></logo> -->
    <languages>
        <language>en_US</language>
        <language>fr_FR</language>
    </languages>
    <version>1.2.3</version>
    <author>
        <name>Gilles Bourgeat</name>
        <email>gilles.bourgeat@gmail.com</email>
        <website>https://github.com/gillesbourgeat</website>
    </author>
    <type>classic</type>
    <thelia>2.1.0</thelia>
    <stability>prod</stability>
</module>
